{
  "title": "CacheBlend: Fast Large Language Model Serving for RAG with Cached Knowledge Fusion",
  "authors": [
    "Jiayi Yao",
    "Hanchen Li",
    "Yuhan Liu",
    "Siddhant Ray",
    "Yihua Cheng",
    "Qizheng Zhang",
    "Kuntai Du",
    "Shan Lu",
    "Junchen Jiang"
  ],
  "arxiv_id": "2405.16444",
  "doi": "10.1145/3689031.3696098",
  "source_url": "https://arxiv.org/abs/2405.16444",
  "abstract": "Large language models (LLMs) often incorporate multiple text chunks in their inputs to provide the necessary contexts. To speed up the prefill of the long LLM inputs, one can pre-compute the KV cache of a text and re-use the KV cache when the context is reused as the prefix of another LLM input. However, the reused text chunks are not always the input prefix, which makes precomputed KV caches not directly usable since they ignore the text's cross-attention with the preceding texts. Thus, the benefits of reusing KV caches remain largely unrealized. This paper tackles just one challenge: when an LLM input contains multiple text chunks, how to quickly combine their precomputed KV caches in order to achieve the same generation quality as the expensive full prefill (i.e., without reusing KV cache)? This challenge naturally arises in retrieval-augmented generation (RAG) where the input is supplemented with multiple retrieved texts as the context. We present CacheBlend, a scheme that reuses the precomputed KV caches, regardless prefix or not, and selectively recomputes the KV values of a small subset of tokens to partially update each reused KV cache. In the meantime, the small extra delay for recomputing some tokens can be pipelined with the retrieval of KV caches within the same job, allowing CacheBlend to store KV caches in slower devices with more storage capacity while retrieving them without increasing the inference delay. By comparing CacheBlend with the state-of-the-art KV cache reusing schemes on three open-source LLMs of various sizes and four popular benchmark datasets of different tasks, we show that CacheBlend reduces time-to-first-token (TTFT) by 2.2-3.3x and increases the inference throughput by 2.8-5x from full KV recompute without compromising generation quality. The code is available at https://github.com/LMCache/LMCache.",
  "sections": [
    {
      "name": "1 Introduction",
      "text": "For their remarkable capabilities, large language models (LLMs) are widely used in personal assistance, AI healthcare, and question answering. To ensure high-quality and consistent responses, applications often supplement the user query with additional texts to provide the necessary context of domain knowledge or user-specific information. A typical example is Retrieval-Augmented Generation (RAG) where a user query will be prepended by multiple text chunks retrieved from a database to form the LLM input.\n\nThese context text chunks, however, significantly slow down LLM inference. This is because, before generating any token, an LLM first uses prefill to go through the entire LLM input to produce the KV cache—concatenation of tensors associated with each input token that embeds the token's \"attention\" with its preceding tokens. Thus, the prefill delay determines the time to first token (TTFT). We refer to it as full KV recompute (Figure 1(a)). Despite many optimizations, the delay and computation of prefill grow super-linearly with the input length, and can easily slow down the service, especially on long LLM inputs (e.g., in RAG).\n\nSo, how do we speed up the prefill of LLM inputs? Recent optimizations embrace the fact that same context texts are often reused by different LLM inputs. They then pre-compute the KV caches of these texts once and re-use the stored KV caches to avoid repeated prefill on these reused texts.\n\nLimitations of existing methods: There are currently two approaches to KV cache reusing, but they both have limitations.\n\nFirst, prefix caching only stores and reuses the KV cache of the prefix of the LLM input (Figure 1(b)). Because the prefix's KV cache is independent of the succeeding texts, prefix caching does not hurt generation quality. However, many applications, such as RAG, include multiple text chunks, rather than one, in the LLM input to provide all necessary contexts to ensure good response quality. Thus, only the first text chunk is the prefix, and other reused texts' KV caches are not reused. As a result, the speed of prefix caching will be almost as slow as full KV recompute when input consists of many reused text chunks.\n\nSecond, full KV reuse aims to address this shortcoming (Figure 1(c)). When a reused text is not at the input prefix, it still reuses the KV cache by adjusting its positional embedding so that the LLM generation will produce meaningful output. However, this method ignores the important cross-attention—the attention between tokens in one chunk with tokens in its preceding chunks. The cross-attention information cannot be pre-computed as the preceding chunks are not known in advance. Yet, cross-attention can be vital to answer queries (e.g., about geopolitics) that naturally require understanding information from multiple chunks jointly.\n\nOur approach: This paper tackles only one challenge: when an LLM input includes multiple text chunks, how to quickly combine their individually pre-computed KV caches, in order to achieve the same generation quality as the expensive full prefill? In other words, we seek to have both the speed of full KV reuse and the generation quality of full KV recompute.\n\nWe present CacheBlend, a system that fuses multiple pre-computed KV caches, regardless of prefix or not, by selectively recomputing the KV cache of a small fraction of tokens, based on the preceding texts in the specific LLM input. We refer to it as selective KV recompute (Figure 1(d)). At a high level, selective KV recompute performs prefill on the input text in a traditional layer-by-layer fashion; however, in each layer, it updates the KV of only a small fraction of tokens while reusing the KV of other tokens.\n\nComparing with full KV recompute, an update fraction of less than 15% can typically generate same-quality responses based on our experience. The deeper reason why it suffices to only updating a small fraction of KV is due to the sparsity of attention matrices (see Section 4.3).\n\nComparing with full KV reuse, CacheBlend achieves higher generation quality with a small amount of extra KV update. Moreover, this small extra computation does not increase the inference latency, because CacheBlend parallelizes partial KV update on one layer with the fetching of the KV cache on the next layer into GPU memory. Such pipelining enables CacheBlend to store KV caches in slower non-volatile devices (e.g., disk) without incurring extra delay, allowing more KV caches to be stored and reused.\n\nTo put our contribution in context, CacheBlend enables the reusing of KV caches of multiple text chunks in one LLM input, without compromising generation quality. This is complementary to the recent work that reduces KV cache storage sizes and optimizes the access patterns of KV cache.\n\nWe implemented CacheBlend on top of vLLM and compared CacheBlend with state-of-the-art KV cache reusing schemes on three open-source LLMs of various sizes and three popular benchmark datasets of two LLM tasks (RAG and QA). We show that compared to prefix caching, CacheBlend reduces time-to-first-token (TTFT) by 2.2-3.3x and increases the inference throughput by 2.8-5x, without compromising generation quality or incurring more storage cost. Compared to full KV reuse, CacheBlend achieves almost the same TTFT but 0.1-0.2 higher absolute F1-scores on QA tasks and 0.03-0.25 higher absolute Rouge-L scores on summarization."
    },
    {
      "name": "2 Background",
      "text": "Most LLM services today use transformers. After receiving the input tokens, the LLM first uses the prefill phase (explained shortly) to transform the tokens into key (K) and value (V) vectors, i.e., KV cache. After prefill, the LLM then iteratively decodes (generates) the next token with the current KV cache and appends the new K and V vectors of the new tokens to the KV cache for the next iteration.\n\nThe prefill phase computes the KV cache layer by layer. The input tokens embeddings on each layer are first transformed into query (Q), key (K), and value (V) vectors, of which the K and V vectors form one layer of the KV cache. The LLM then multiplies Q and K vectors to obtain the attention matrix—the attention between each token and its preceding tokens—and does another dot product between the (normalized and masked) attention matrix with the V vector. The resulting vector will go through multiple neural layers to obtain the tokens' embeddings on the next layer.\n\nWhen the KV cache of a prefix is available, the prefill phase will only need to compute the forward attention matrix (between the suffix tokens and the prefix tokens) on each layer which directly affects the generated token.\n\nThe prefill phase can be slow, especially on long inputs. For instance, on an input of four thousand tokens (a typical context length in RAG), running prefill can take three (or six) seconds for Llama-34B (or Llama-70B) on one A40 GPU. This causes a substantial delay that users have to wait before seeing the first word generated. Recent work also demonstrates that prefill can be a throughput bottleneck, by showing that getting rid of the prefill phase can double the throughput of an LLM inference system."
    },
    {
      "name": "3 Motivation",